{
  "clone": "aws-clone",
  "commit": "36e78af262eac179dc118662003f9ab5f7067b3f",
  "audited_at": "2026-06-30",
  "standard_version": "clone-standard-v1",
  "fidelity_tier": { "declared": "T3", "observed": "T3" },
  "meets_standard": false,
  "gating_passed": 1,
  "gating_total": 6,
  "requirements": {
    "R1": {
      "result": "fail",
      "gating": true,
      "evidence": "Gateway cold-boots healthy in ~54s (amd64 emulated) and serves the corpus over the real AWS API, but no tests/test.sh entrypoint and no solution/solve.sh exist anywhere in the repo — nop/oracle (R1.3) is unmeasurable. Clone ships as a reusable sidecar, not a bundled Harbor task."
    },
    "R2": {
      "result": "fail",
      "gating": true,
      "evidence": "Runtime canon gates a,c,d,e,g pass (verified: leak-clean python:slim agent, mount-not-copy data, token-gated operator boundary). But b/j fail: no :prod-v1/:empty trio (imagetools inspect :prod-v1 -> not found), corpus not baked into any image (no COPY <corpus> -> DB). k fails: GHCR image is single-arch linux/amd64 (arm64 pull -> 'no matching manifest for linux/arm64/v8'; CI declares no platforms:).",
      "sub": {
        "a": "pass",
        "b": "fail",
        "c": "pass",
        "d": "pass",
        "e": "pass",
        "f": "partial",
        "g": "pass",
        "h": "partial",
        "i": "partial",
        "j": "fail",
        "k": "fail"
      }
    },
    "R3": {
      "result": "fail",
      "gating": true,
      "evidence": "No MCP server ships. Exhaustive `grep -ril mcp` over the repo returns no matches. Agent operates only the real CLI (aws/awslocal) plus operator-only aws-clonectl. The named 'both CLI + MCP in parity' goal is unmet."
    },
    "R4": {
      "result": "partial",
      "gating": true,
      "evidence": "Real AWS surface is well-covered and envelope-faithful (live: real SQS QueueUrls, DynamoDB typed items, ResourceNotFoundException). But docs/COVERAGE.md is absent (R4.1) — no machine-checkable matrix; and every row lacks an MCP mapping (R4.2)."
    },
    "R5": {
      "result": "pass",
      "gating": true,
      "evidence": "Verified live: DynamoDB write->read round-trip (put-item -> get-item returns 'done'); realistic typed error (ResourceNotFoundException, not 500); query grammar via --query and logs --filter-pattern; IAM shim devops shape (simulate-custom-policy -> allowed, computed from live policy state). >=6 assessment-grade capabilities; round-trip exercised."
    },
    "R6": {
      "result": "partial",
      "gating": true,
      "evidence": "34/34 pytest pass from a clean py3.13 venv (seed rendering, IAM policy engine, credential report, admin auth, state schema, CLI/admin parity vs in-process server). But no MCP tests (none can exist), no in-agent isolation test asserting import aws_clone.seed raises, and AWS endpoint/CLI coverage is compose-smoke not per-capability happy+error."
    }
  },
  "coverage": {
    "capabilities_total": 12,
    "with_cli": 12,
    "with_mcp": 0,
    "parity_ok": 0,
    "assessment_grade": 6,
    "tested": 4
  },
  "tests": {
    "passed": 34,
    "total": 34
  },
  "action_items": [
    {
      "requirement": "R3",
      "gating": true,
      "priority": "P0",
      "summary": "No MCP server — add aws-mcp over the same AWS surface, in CLI parity, wired into the agent image.",
      "where": "new aws_clone/mcp/ + bin/aws-mcp + Dockerfile.tools / examples/task-pack-compose/Dockerfile.agent",
      "acceptance": "MCP server lists >=10 tools; parity test shows `aws s3 ls` and the s3 MCP tool return the same buckets; agent isolation still holds."
    },
    {
      "requirement": "R2",
      "gating": true,
      "priority": "P0",
      "summary": "No :prod-v1/:empty image trio and corpus not baked — add baked-DB :prod-v1 that boots mount-free + :empty mount target.",
      "where": "Dockerfile.prod-v1 (COPY state.json + boot load) + .github/workflows/build-service-image.yml tags",
      "acceptance": "docker run :prod-v1 with no -v then `awslocal s3 ls` -> acme-payment-exports; :empty + mount also serves mounted data; switch is the tag alone."
    },
    {
      "requirement": "R2",
      "gating": true,
      "priority": "P0",
      "summary": "GHCR image published amd64-only — publish multi-arch (linux/amd64,linux/arm64).",
      "where": ".github/workflows/build-service-image.yml (build-push-action platforms:) + docs/IMAGE-RELEASE.md",
      "acceptance": "imagetools inspect :main lists linux/amd64 and linux/arm64; docker pull succeeds on arm64 with no --platform."
    },
    {
      "requirement": "R1",
      "gating": true,
      "priority": "P0",
      "summary": "No bundled task with test.sh/solution — nop/oracle unmeasurable. Bundle >=1 runnable task.",
      "where": "environment/docker-compose.yaml, tests/test.sh (-> /logs/verifier/reward.txt), solution/solve.sh, per-task data/aws-clone/state.json",
      "acceptance": "test.sh on empty solution -> 0.0; after solve.sh -> 1.0."
    },
    {
      "requirement": "R4",
      "gating": true,
      "priority": "P1",
      "summary": "No docs/COVERAGE.md matrix — add machine-checkable coverage matrix labelling >=5 assessment-grade rows.",
      "where": "docs/COVERAGE.md",
      "acceptance": "every capability maps to endpoint + CLI + MCP tool; >=5 rows marked assessment-grade."
    },
    {
      "requirement": "R6",
      "gating": true,
      "priority": "P1",
      "summary": "Add per-capability endpoint+CLI happy/error tests, MCP + CLI<->MCP parity tests, and an in-agent isolation test.",
      "where": "tests/test_aws_surface.py, tests/test_mcp_parity.py, tests/test_isolation.py",
      "acceptance": "green from cold boot; parity passes for s3/sqs/dynamodb; isolation asserts import aws_clone.seed raises in the agent image."
    },
    {
      "requirement": "R2",
      "gating": false,
      "priority": "P2",
      "summary": "Document identity-registry applicability (likely N/A for AWS) and add a PROD-OVERLAY note.",
      "where": "docs/ (new PROD-OVERLAY.md or section)",
      "acceptance": "canon advisories h/i explicitly addressed in docs."
    }
  ]
}
