{
  "clone": "abundant-jira-clone",
  "commit": "b2b2abd",
  "audited_at": "2026-06-30",
  "standard_version": "clone-standard-v1",
  "fidelity_tier": { "declared": "T2", "observed": "T2" },
  "meets_standard": true,
  "gating_passed": 7,
  "gating_total": 7,
  "requirements": {
    "R1": {
      "result": "pass",
      "gating": true,
      "evidence": "Live nop=0 / oracle=1 reconfirmed on the NEW jira-transition-roundtrip task: nop (empty answer, no mutation) -> verifier reads state='To Do', comments=0 -> reward=0; oracle (solve.sh: `jira issue transition WEB-7 Done` + `jira issue comment add` over HTTP) -> verifier reads state='Done', comments=1, answer=WEB-7 -> reward=1. R1.5 RESOLVED: all 3 task composes carry the build:+image: dual (build.context=selfcontained/base); ticketvector base AND jira-gateway:{prod-v1,empty} are now anonymously pullable from GHCR, so a clean machine resolves the gateway with no auth and no manual build step. Round-1's R1.5 half-failure (local-tag-only + authenticated agent COPY) no longer reproduces."
    },
    "R2": {
      "result": "pass",
      "gating": true,
      "evidence": "R2.j: prod-v1 bakes the corpus, serves mount-free; empty serves a mounted state.json. R2.k LEAK FIXED (the round-1 headline): Dockerfile.agent now COPYs the package then runs strip_agent_tooling.py, which deletes server/seed/plane/demo/runtime/snapshot.py and rewrites cli.py's imports to raising shims. Verified on a FRESH agent build (jira-agent:jirare-audit): `import world_issues.seed` (and server/plane/demo/runtime/snapshot) all RAISE ModuleNotFoundError; `find /opt -name seed.py -o -name server.py ...` returns nothing; no `Priya Fischer`/`ENG-2016` greppable in /opt /var /workspace /usr; no /var/lib/ticketvector/state.json on disk; yet `import world_issues.cli` + `jira`/`linear`/`world-issues` still work and the MCP server lists 11 tools. Multi-arch half (R2.k) is n/a (unverified) locally — confirmed upstream blocker: `docker buildx imagetools inspect ticketvector-service:latest` is linux/amd64-only (the other manifest is an attestation), so arm64 cannot be produced from this repo.",
      "sub": {
        "a": "pass", "b": "pass", "c": "pass", "d": "pass", "e": "pass",
        "f": "pass", "g": "pass", "h": "pass", "i": "pass",
        "j": "pass", "k": "pass"
      }
    },
    "R3": {
      "result": "pass",
      "gating": true,
      "evidence": "New mcp/ MCP server (jira-mcp): FastMCP-over-stdio with a stdlib JSON-RPC stdio fallback for the dependency-free agent image. tools/list returns 11 tools (get_issue, search_issues, get_comments, list_links, issue_history, issue_mine, list_projects, list_states, list_labels, transition_issue, add_comment). It imports nothing from world_issues — mcp/client.py is a self-contained /rpc thin client; verified it lists tools and runs INSIDE the stripped agent image (where world_issues.server/seed are gone). Live tool round-trip against jira-gateway:empty+WEB fixture: search_issues/get_issue read OK; transition_issue write round-trips (transition -> readback == 'In Progress'). CLI<->MCP parity verified live head-to-head (project_list, JQL `priority in (...)` incl next_cursor, `issue query --assignee`, `issue view`) AND by the in-suite test_parity.py (8 tests, all RAN/passed, none skipped — the upstream CLI was extracted and compared)."
    },
    "R4": {
      "result": "pass",
      "gating": true,
      "evidence": "docs/COVERAGE.md is a machine-checkable matrix: 14 capability rows, each mapped to /rpc method + CLI command + MCP tool + R/W + envelope + assessment-grade flag + tested flag. All 14 have CLI and MCP coverage; 5 rows labelled assessment-grade (JQL, issue query+pagination, transition, add comment, get issue). Includes an explicit out-of-scope section. Matches observed behavior (11 MCP tools; rows 2/5/7 collapse onto get_issue/search_issues/get_comments)."
    },
    "R5": {
      "result": "pass",
      "gating": true,
      "evidence": ">=5 assessment-grade capabilities documented with the >=3-of-5 criteria table. R5.2 write->read round-trip exercised end-to-end by the bundled jira-transition-roundtrip task: agent transitions an issue + adds a comment via the CLI, verifier reads both back through the same /rpc API (confirmed live: oracle reward=1). T2 fidelity surface (real JQL grammar, {results,next_cursor} pagination, {ok:false,error_type,error} envelopes with NotFoundError/ConflictError/UnsupportedCommandError) is real and now documented."
    },
    "R6": {
      "result": "pass",
      "gating": true,
      "evidence": "pytest suite (tests/): 38 passed, 0 skipped, 0 failed in ~31-44s, run against a freshly booted jira-gateway:empty + WEB fixture. Breakdown: test_mcp_tools.py 20 (every tool, happy + error paths incl JqlError/NotFoundError, transition & comment round-trips), test_parity.py 8 (CLI vs MCP head-to-head, all RAN — none skipped), test_isolation.py 10 (leak probes against the built jira-agent image: seed + 5 modules not importable, no state.json, no seed/server source on disk, CLI present, MCP lists tools). CI workflow .github/workflows/ci.yml builds the trio + runs pytest on push/PR and publishes multi-arch on main (arm64 leg continue-on-error per upstream blocker)."
    },
    "R7": {
      "result": "pass",
      "gating": true,
      "evidence": "This re-audit emits audit/audit-report.md + audit/audit-verdict.json with per-requirement results, the exact evidence commands run, and a residual action list."
    }
  },
  "coverage": {
    "capabilities_total": 14,
    "with_cli": 14,
    "with_mcp": 14,
    "parity_ok": 14,
    "assessment_grade": 5,
    "tested": 14
  },
  "tests": {
    "passed": 38,
    "total": 38,
    "nop_reward": 0.0,
    "oracle_reward": 1.0
  },
  "action_items": [
    {
      "requirement": "R2",
      "gating": false,
      "priority": "P1",
      "summary": "Publish the gateway+agent multi-arch. BLOCKED UPSTREAM: ghcr.io/abundant-ai/ticketvector-service:latest is amd64-only, so the arm64 leg of R2.k cannot be produced from this repo until the ticketvector base is republished multi-arch. CI already declares both platforms with arm64 continue-on-error.",
      "where": "upstream ghcr.io/abundant-ai/ticketvector-service (NOT this repo); .github/workflows/ci.yml publish matrix",
      "acceptance": "docker buildx imagetools inspect ghcr.io/abundant-ai/jira-gateway:prod-v1 lists linux/amd64 AND linux/arm64 (gated on a multi-arch ticketvector base)."
    },
    {
      "requirement": "R1",
      "gating": false,
      "priority": "P2",
      "summary": "Residual R1.5 nicety: Dockerfile.agent still COPYs --from=ghcr.io/abundant-ai/ticketvector-service:latest with no local-build fallback. Currently fine because that base is anonymously pullable; if it ever goes private the agent build breaks. Consider a build-arg base or a vendored fallback.",
      "where": "selfcontained/base/Dockerfile.agent lines 19-21",
      "acceptance": "Agent image builds on a clean machine with no GHCR auth even if the ticketvector package is made private (build-arg or vendored COPY source)."
    },
    {
      "requirement": "R4",
      "gating": false,
      "priority": "P2",
      "summary": "Stale README task table (carried from round-1): README claims ENG-2016 assignee 'Felix Martin'; live corpus returns 'Priya Fischer' (Done). Reconcile the doc with the live prod-v1 corpus.",
      "where": "README.md task table",
      "acceptance": "README matches `jira issue view ENG-2016` against jira-gateway:prod-v1 (Done / Priya Fischer)."
    }
  ]
}
