{
  "clone": "grafana-clone",
  "commit": "b2b2abd",
  "audited_at": "2026-06-30",
  "standard_version": "clone-standard-v1",
  "fidelity_tier": {
    "declared": "T2",
    "observed": "T2"
  },
  "meets_standard": true,
  "gating_passed": 6,
  "gating_total": 6,
  "requirements": {
    "R1": {
      "result": "pass",
      "gating": true,
      "evidence": "New task oddish/tasks/gauge-annotation-roundtrip bundles tests/test.sh (writes /logs/verifier/reward.txt via run_verifier.sh) + solution/solve.sh. `bash validate_local.sh` builds the thin agent + grafana gateway (fixture.json mounted into the SERVICE only), runs nop/oracle/decoy: nop=0, oracle=1 (annotation write->read round-trip read back over HTTP), decoy=0. Agent reaches gateway by name http://grafana. No real networks: key (only comment text). build:+image: dual on the grafana service => no GHCR pull needed (R1.5).",
      "sub": {
        "R1.1": "pass",
        "R1.2": "pass",
        "R1.3": "pass",
        "R1.4": "pass",
        "R1.5": "pass"
      }
    },
    "R2": {
      "result": "pass",
      "gating": true,
      "evidence": "Dockerfile.prod-v1 (FROM :empty, COPY examples/data/grafana/state.json -> /srv/grafana/state.json, GRAFANA_STATE_FILE points at baked corpus). Built :empty then :prod-v1; booted :prod-v1 mount-free (anonymous VOLUMEs only, /data/grafana empty) -> `gcx dashboards search payment --json` returns dash-payment-webhooks from the BAKED state file. :empty mount-free crashes FileNotFoundError (it is a mount target) and serves the corpus when fixture.json is mounted -> empty<->prod-v1 is the tag/state-file alone. Agent leak strip verified on the built agent image: literal grep for 'lock_conflict'/'dash-payment-webhooks' finds nothing; `import grafana.server.state` (and query_engine/app/clone_admin/etc.) raises ModuleNotFoundError; only links.py + __init__.py survive in grafana/server; gcx+mcp-grafana still load; grafanactl absent. CI workflow declares platforms: linux/amd64,linux/arm64 for both :empty and :prod-v1; GHCR package not yet published so multi-arch half scored n/a (unverified) per the hardened rule, not fail.",
      "sub": {
        "a": "pass",
        "b": "pass",
        "c": "pass",
        "d": "pass",
        "e": "pass",
        "f": "pass",
        "g": "pass",
        "h": "partial",
        "i": "partial",
        "j": "pass",
        "k": "pass"
      }
    },
    "R3": {
      "result": "pass",
      "gating": true,
      "evidence": "mcp_server.TOOLS = 24 MCP tools (mcp-grafana surface); gcx CLI has 9 command groups (config/whoami/dashboards/datasources/metrics/logs/alert/annotations/links). 14 parity cases assert _canon(CLI json) == _canon(MCP tool) against the same in-process HTTP API; --disable-write drops exactly create_annotation (24->23). Both are thin clients of one HTTP API (grafana.cli.client)."
    },
    "R4": {
      "result": "pass",
      "gating": true,
      "evidence": "docs/COVERAGE.md present and machine-checkable: 32 table rows mapping capability -> HTTP endpoint + gcx CLI + mcp-grafana MCP tool + envelope fidelity + AG + tested. Behavioral coverage verified by calling each (search, ds/query PromQL+LogQL, alert-instances, annotations) with Grafana-shaped envelopes."
    },
    "R5": {
      "result": "pass",
      "gating": true,
      "evidence": "8 capabilities flagged assessment-grade in COVERAGE.md (>=5 required): dashboard variables, panel query exec, PromQL query grammar, Prom label-values, LogQL query grammar, alert-instances list+filter, annotation create write->read RT, label-values multi-step. The annotation write->read round-trip is exercised end-to-end by the bundled gauge-annotation-roundtrip task (oracle=1, decoy=0) and by tests/test_parity.py::test_parity_write_read_roundtrip."
    },
    "R6": {
      "result": "pass",
      "gating": true,
      "evidence": "Cold venv (python3.13, pip install -e .[dev]): `pytest -q` => 54 passed with NO GRAFANA_RUN_DOCKER_SMOKE. test_parity.py (16 tests incl 14 CLI==MCP parity cases + write->read roundtrip + disable-write control) and test_isolation.py (12 tests: 9 import-leak module checks asserting `import grafana.server.*` raises, no-server-source-survives, tools-still-import, links-pure, and an assertion that the agent Dockerfiles perform the strip+probe) BOTH run by default. The docker compose smoke tests self-skip (early-return, pass) when the gate is unset.",
      "sub": {
        "R6.1": "pass",
        "R6.2": "pass",
        "R6.3": "pass",
        "R6.4": "pass"
      }
    },
    "R7": {
      "result": "pass",
      "gating": true,
      "evidence": "audit/audit-report.md and audit/audit-verdict.json emitted per the _shared schemas with per-requirement results, executed-command evidence, and ordered action items."
    }
  },
  "coverage": {
    "capabilities_total": 19,
    "with_cli": 18,
    "with_mcp": 18,
    "parity_ok": 18,
    "assessment_grade": 8,
    "tested": 19
  },
  "tests": {
    "passed": 54,
    "total": 54,
    "nop_reward": 0.0,
    "oracle_reward": 1.0
  },
  "action_items": [
    {
      "requirement": "R2",
      "gating": false,
      "priority": "P1",
      "summary": "Publish the gateway image trio to GHCR so multi-arch is independently verifiable (CI declares amd64+arm64 but the ghcr.io/abundant-ai/grafana-service package is not yet pullable: `docker manifest inspect ...:prod-v1` => manifest unknown). Scored n/a (unverified) per the hardened R2.k rule, not fail, because the build:+image: dual lets the task run without a pull.",
      "where": ".github/workflows/build-service-image.yml (push-to-main) + make the GHCR package public",
      "acceptance": "`docker manifest inspect ghcr.io/abundant-ai/grafana-service:prod-v1` lists linux/amd64 + linux/arm64."
    },
    {
      "requirement": "R2",
      "gating": false,
      "priority": "P2",
      "summary": "Wire the identity registry (abundant-identity) and add the PROD-OVERLAY/catalog doc (advisory R2.h/R2.i still partial).",
      "where": "docs/PROD-OVERLAY.md, identity wiring in seed",
      "acceptance": "people resolve through abundant-identity; PROD-OVERLAY doc present."
    }
  ]
}
